{
  "service_id": "apple",
  "name": "Apple",
  "domains": [
    "apple.com"
  ],
  "aliases": [],
  "renamed_from": [],
  "asset_class": "brand",
  "tier": 0,
  "status": "active",
  "lock": "binding",
  "composition_hint": "glyph",
  "notes": "R1 canary acquired; promoted to curated_seed priority after fetch verification"
}
