{
  "service_id": "wechat",
  "name": "WeChat",
  "domains": [
    "weixin.qq.com"
  ],
  "aliases": [],
  "renamed_from": [],
  "asset_class": "brand",
  "tier": 0,
  "status": "active",
  "lock": "binding",
  "composition_hint": "glyph",
  "notes": "Curated App Store/brand hires; reviewer may replace"
}
