{
  "service_id": "woocommerce",
  "name": "WooCommerce: Store & POS",
  "domains": [],
  "aliases": [],
  "renamed_from": [],
  "asset_class": "brand",
  "tier": 1,
  "status": "active",
  "lock": "binding",
  "composition_hint": "app_icon",
  "notes": "Auto App Store: WooCommerce: Store & POS; REVIEW REQUIRED"
}
