{
  "service_id": "github_mobile",
  "name": "GitHub",
  "domains": [
    "github.com"
  ],
  "aliases": [],
  "renamed_from": [],
  "asset_class": "brand",
  "tier": 0,
  "status": "active",
  "lock": "binding",
  "composition_hint": "app_icon",
  "notes": "App Store interim (GitHub); reviewer may replace"
}
