{
  "service_id": "tmall",
  "name": "天猫",
  "domains": [
    "tmall.com"
  ],
  "aliases": [],
  "renamed_from": [],
  "asset_class": "brand",
  "tier": 0,
  "status": "active",
  "lock": "binding",
  "composition_hint": "app_icon",
  "notes": "Interim App Store icon (天猫 - 好品牌，好价格，上天猫); reviewer may replace"
}
